id,platform,title,content,rating,version,author,updated
13324086872,macOS,一直闪退,根本打不开这个应用，赶紧更新吧，就第一次下载能打开，之后根本没打开过,2,2.2.200,糖果小熊不在家过个好借口,2025-10-28 00:37:28
13323790397,macOS,连接不上,无论如何都连接不上我的小米手机,1,2.2.0,太空6689,2025-10-27 22:24:55
13323700630,macOS,垃圾，平板不支持,垃圾，平板不支持，不是科技平权吗,1,2.2.200,jerkuang,2025-10-27 21:42:43
13321550786,macOS,连不上手机,iPad是最新的iPados26系统，小米手机也是最新的澎湃3，确保链接同一Wi-Fi，蓝牙也都开了，但就是显示连接失败,1,2.2.0,Dirk2333,2025-10-27 09:13:22
13320309576,macOS,无耻的公司无耻的产品,出了澎湃3后，澎湃2的手机用不了互传了，直接把澎湃2系统的手机给屏蔽掉，你这是人吗？互传照片是为了方便与iPhone进行传输，对两个品牌的手机产品，与消费者都是好事，现在强制要求升级澎湃3，对与老机器来讲就是让其变卡顿然后换机，但是我下一台手机不会再用小米了，不为其他，就是因为看不惯恶心公司的恶心行为。,1,2.2.0,可是大家送就是患得,2025-10-27 03:25:40
13320058520,macOS,满怀希望的来…,槽点：1，还是需要连接同一个wifi。2，电脑插网线搜索不到手机、生成连接二维码也不能用。3，没了，因为压根没连接上。也许这确实不是软件层面能解决的事情。但是在两个都有无线网卡、蓝牙的设备，如果一切功能都需要连接同一个网络才可以使用，那么这个软件确实没有存在的意义。,3,2.2.200,laycept,2025-10-27 01:52:18
13316712381,macOS,垃圾,根本连不起,1,2.2.0,xiaotae,2025-10-26 06:50:14
13314490619,macOS,关于启用热点问题,在iPhone上通过小米互联服务打开小米手机热点，iPhone熄屏后就会自动断开。小米手机主动打开热点iPhone连接后不会自动断开，希望尽快修复问题,4,2.2.0,sancasi1,2025-10-25 17:55:30
13310426717,macOS,为什么不把系统弄到米UI传送？,我的小米9上传给苹果都穿不了,1,2.2.0,槻泉ovo,2025-10-24 20:05:07
13308259638,macOS,通知鸡肋,能通知的应用就这么几个 佩戴applewatch还是极其不好用  乖乖让小米手机连接Apple Watch啊 学学别的厂啊 速度怎么就这么慢呢,3,2.2.0,laji小米,2025-10-24 08:08:11
13307468950,macOS,我真的服了，明明写着支持澎湃2.0，但是打开应用只能3.0才能用,自己家手机都不支持，你不废了吗？,1,2.2.0,jemi2583,2025-10-24 04:41:27
13304118797,macOS,垃圾虚假宣传,小米根本收不到苹果手机微信上的消息,1,2.2.0,o io o,2025-10-23 08:23:51
13302396224,macOS,你倒是升级3.0版本的互联啊,你倒是升级3.0版本的互联啊,1,2.2.0,突然反正我,2025-10-22 23:01:09
13299604858,macOS,根本用不了,发现不了设备，扫码添加提示手机系统要升级到澎湃OS3，不是最新的手机就该扔是吗,1,2.2.200,恶魔的金融街风格,2025-10-22 06:53:48
13298953833,macOS,对不起碟我错了，os2也能用，我再也不黑小米了,Mac mini带出去忘拿键盘了，抱着试一试的心态搞了下，没想到真行,5,2.2.200,66】1313点,2025-10-22 03:49:47
13298556501,macOS,石,卡就算了，一堆问题，尤其是呼出键盘情况下 点开表情包键盘都下不去,1,2.2.0,xQn,2025-10-22 01:22:09
13297890885,macOS,很爽，摸鱼神器，比iPhone镜像好用,18老mbp小米15pro妙享桌面体验流畅，比用iPhone镜像连iPhone16promax还要流畅，摸鱼神器,5,2.2.200,雩风拾叁,2025-10-21 20:38:17
13294828288,macOS,一直好好的今天出问题了,传图片一直提示无法获取相册路径,3,2.2.0,Huif679,2025-10-21 04:18:03
13294226542,macOS,完全不能用,我请问你互联在哪里呢？搜索搜索不到，扫描扫描不出，真是扫了码的宣传,1,2.2.0,这很难评124,2025-10-21 00:32:59
13294139585,macOS,显示微信微信分身消息看不到,微信双开的微信相当于没有用mg,5,2.2.0,微信双开…,2025-10-20 23:56:39
13293935058,macOS,传输视频没有相机信息和位置信息,程序员快把这一块加上啊,4,2.2.0,麦小区大王,2025-10-20 22:26:25
13293738717,macOS,希望增加鼠标滚轮支持,番茄小说等小说软件 用滚轮可以下翻,4,2.2.200,爱仕达大所多所多,2025-10-20 20:59:36
13293420051,macOS,卡卡卡,妙享桌面卡的一批 这样的产品还好意思上架呢,1,2.2.200,arcustin,2025-10-20 18:50:15
13293163463,macOS,优化流畅度。真的太卡了,小米手机可以接听 iPhone 电话也是很有用的，可以让 iPhone 用户体会到小米手机的便捷好用，还有就是互联互通的时候 iPhone 打开小米手机的微信想要发图片只能发小米手机里面的图片如果可以同时发 iPhone 手机里面的图片就好了，包括打视频通话的时候可以调用 iPhone 摄像头就好了，还有就是互联互通的时候用 iPhone 看小米手机的微信振动好卡，下午尽快优化，并且适配一下 iPhone 的返回逻辑，要不然只能点左上角或者右上角返回键不太方便。 用镜像的时候真的好卡。卡得让人受不了了。,4,2.2.0,麋鹿测试的意义是什么,2025-10-20 17:12:07
13289994740,macOS,软件自动更新后不能用了，手机没有什么3系统,你让我怎么用？开玩笑呢,1,2.2.0,小米服了,2025-10-20 00:58:32
13289406557,macOS,小米单向奔赴吗,小米只能看苹果消息，无法回复。苹果用小米微信好卡，希望继续优化。,3,2.2.0,qjwbsndke,2025-10-19 20:47:16
13289369868,macOS,原先用得好好的，自动升级后就要os3才能用了。,用个互传软件还有门槛，要不就不做，做出来恶心人是怎么回事？,1,2.2.0,你说是啥就是啥，你都对,2025-10-19 20:31:48
13282737012,macOS,卡得要死,用苹果手机传照片到小米，前面还好好的，后面传卡的都点不了，别的应用就啥事没有，就点不了这个,1,2.2.0,温柔寄于小莹,2025-10-18 07:59:17
13282613820,macOS,打不开,打不开啊，报错,1,2.2.200,09oik,2025-10-18 07:29:01
13282189444,macOS,希望小米软件团队可以看到这个评论,感谢你们的付出，开发出这么有用的app，其次我发现了一个Bug，就是在屏幕比例不一样时，在使用微信QQ时无法精确点中所选目标。比如我使用iPhone8P时，浏览消息勉强可以，但下面编辑消息的按键由于比例问题无法点中，有点烦恼，希望可以排查修复。,4,2.2.0,via-2004,2025-10-18 05:41:11
13281078844,macOS,不好使,小米往苹果传就好使，反过来苹果往小米传就不好使？,1,2.2.0,及时既定,2025-10-17 23:29:58
13280577742,macOS,更新了还是闪退,"一直闪退,更新了也一样",1,2.2.200,ymLW 1,2025-10-17 20:10:09
13278829878,macOS,5星是为了让我在上面,macOS12安装完成闪退，多次报错无法使用,5,2.2.200,我爱上judal,2025-10-17 09:57:34
13276795984,macOS,请多支持几个能镜像到iphone的应用,"虽然镜像有点卡，但是有，比没有好，既然都能镜像了，为什么不放开些。非要我把小米手机的应用装到iphone上来吗？
请认真考虑一下建议。",4,2.2.0,小杰Li,2025-10-16 23:26:44
13276748725,macOS,出个软件又要登录账号又要最新系统,太垃圾了，又要登录账号又要最新系统，这么多年了，系统都做不好，直接转Oppo了,1,2.2.0,白尘清风,2025-10-16 23:06:27
13274491533,macOS,为啥os3才能用？,我小米平板最新版本也才os2，我从哪去给你变个os3出来？现在手机和平板都没法传东西了，很耽误事，你倒是让我的平板能更新到os3啊！,3,2.2.0,我真的服了river,2025-10-16 09:20:56
13273804781,macOS,差劲,之前14pro用的好好的你发布了17就不给用了是吧？os3才能用真是下头，还在os2的老用户怎么办？,1,2.2.0,imyao,2025-10-16 06:18:59
13271935332,macOS,抛弃老系统用户,原来可以的功能，升级后要强制手机升级到澎湃3.0才能用，问题你没有推送！,1,2.2.0,马代码,2025-10-15 18:46:06
13269561716,macOS,专注模式下通知还是会响,打开专注模式，小米手机也开了勿扰模式 通知还是会不断推送到iPhone 而且让iPhone一直响 开了勿扰模式都还是会通知,1,2.2.0,Ding-Oliver,2025-10-15 06:18:19
13268872731,macOS,非常难用，直接转vivo,1.不支持旧小米，小米12竟然不支持传iphone？ 2.这个小工具竟然还要登陆，为什么不学vivo,1,2.2.0,✅iphone用户,2025-10-15 02:51:14
13267802990,macOS,小米生态里面最差的,最差劲的一个软件，登录就闪退，一点也无法使用。真的是垃圾软件，用过那么多小米的，这个是最差的，实习生做的还是外包的学生做的啊。要点脸吗，丢小米的脸，,1,2.2.200,也还好嘿嘿,2025-10-14 19:30:34
13265626432,macOS,小米收不到苹果通知,苹果可以收到小米，反过来不行,1,2.2.0,嗷嗷菌,2025-10-14 07:31:03
13264453012,macOS,还是不太稳定啊,"不稳定，当软件退出，苹果会自动断开连接。然后小米的微信会收不到。各种问题吧。
连了蓝牙，苹果网络会卡",3,2.2.0,贝格漫,2025-10-14 01:14:31
13261365216,macOS,图标请适配一下ios深色模式,真的很需要，在用其他app都是适配的，就这个，深色模式下，还是显示浅色的图标，很突兀。,5,2.2.0,Allan.official,2025-10-13 07:09:47
13260306383,macOS,无限闪退,无限闪退无限闪退无限闪退无限闪退无限闪退无限闪退无限闪退无限闪退无限闪退无限闪退无限闪退无限闪退无限闪退无限闪退无限闪退无限闪退,1,2.1.0.200,轻轻按星来评分,2025-10-13 01:31:24
13259512711,macOS,为啥之前可以的功能现在不行了,为什么现在澎湃os2不能用啊，现在大多数还是2啊，之前也能用来传东西来着，现在手机传不到iPad上了，但是iPad可以传到手机上手机系统是澎湃2iPad系统iOS26,2,2.2.0,君尘泽,2025-10-12 19:57:26
13254997506,macOS,垃圾,同步连上了断不开了，只能卸载app,1,2.2.0,实话评论家,2025-10-11 19:02:49
13254809260,macOS,os3才能用？,os3出来才几天？全量推送了吗就整这出？我米15都没推到,1,2.2.0,15407790685,2025-10-11 17:54:20
13246789882,macOS,小米手机收不到苹果的消息,为什么系统都是最新的软件也是新版。然而苹果手机能收到小米的。小米收苹果的电话微信短信都收不到。,2,2.2.0,倪的胖虎,2025-10-09 21:17:28
13246424949,macOS,互传值得使用，感谢，同时附上建议,"1：希望能支持剪贴板同步，小米17和Mac电脑互传
2：希望支持dock图标隐藏，缩放到顶部菜单中
———
其他功能目前是很好用的，辛苦开发者了。",4,2.1.0.200,一颗乐芽,2025-10-09 18:50:44
13246243652,macOS,更新后闪退,闪退闪退闪退，根本无法使用，打开软件秒退，无论是AppStore，还是网上下载的，都一样，旧版本在哪里，旧版本还能用用,1,2.1.0.200,木木老谭,2025-10-09 17:41:51
13243340933,macOS,挺方便的,挺好用的，用起来很方便,5,2.1.0.200,CornXTT,2025-10-09 02:32:07
13242723945,macOS,一直闪退,下载安装，登陆后一直闪退,1,2.1.0.200,阿思达都是按,2025-10-08 22:18:04
13242709012,macOS,小米的软件真垃圾,小米软件一如既往的垃圾,1,2.2.0,而对的人,2025-10-08 22:11:38
13238899288,macOS,废物软件,根本连不上，以前澎湃2.0的时候还很好用，现在反而一点也不好用了,1,2.1.0.200,可乐瓶OMG,2025-10-08 00:52:33
13235728849,macOS,小米👍,兼容性太牛了iPhone小屏双持党喜欢😘,5,2.2.0,🐟小鱼儿🐠🐟🐟,2025-10-07 06:46:58
13234043213,macOS,垃圾公司弄的垃圾软件,小米搞的这些就是垃圾，装完之后提示还要小米手机需要升级到OS 3才能用，我刚买的红米就只能升级到OS 2.0，真的是垃圾来的,1,2.2.0,土土康,2025-10-06 20:50:25
13231561097,macOS,下载图片偏亮,iPhone在小米互联服务上下载小米相册的图片怎么这么亮，没有开HDR，图片细节都没有了，完全用不了。,3,2.2.0,凉拌黄瓜大王,2025-10-06 07:16:04
13226339412,macOS,有毛病吧,以前用的正正常常，现在要Os3才能用。你os3才放到几款手机啊？！？？！,1,2.2.0,JeoaoY,2025-10-05 03:28:37
13225420648,macOS,好用,喜欢！好用，传照片速度很快,5,2.2.0,不爱吃芝麻啊,2025-10-04 21:55:25
13224752538,macOS,建议,希望能做到苹果手机，小米平板互联,5,2.2.0,吃猫咪的老鼠,2025-10-04 17:42:20
13216552912,macOS,不是，加个一键下载全部相册图片很难吗？？,？？,5,2.2.0,谢咪蒙,2025-10-02 21:37:46
13214025393,macOS,红米K平板无法互联互通,平板已升级澎湃3，苹果也下载最新版本的小米互联服务，只能互传图片，连接平板时，一直提示连接失败，已经是同一个热点，同一个账号，,1,2.2.0,昵称一直被占用。,2025-10-02 07:50:21
13213020703,macOS,不合理,我的手机等了快一个月都没更澎湃os3，后来才知道差不多到明年初才能更，但是苹果端只支持os3，这就根本用不了,2,2.2.0,0000897967756532345678,2025-10-02 03:17:09
13210015459,macOS,小米传苹果动图偏色,抓紧改进，最新的17pro给苹果传动图时，颜色特别白，应该是系统问题,2,2.2.0,很好哈哈哈哈恩,2025-10-01 09:46:17
13209278740,macOS,真垃圾。根本用不了,必须要澎湃os3才能使用，我去哪更新os3啊，根本搜索不到小米手机,1,2.2.0,YaN20210000293873,2025-10-01 06:42:38
13207620009,macOS,软件不错，投屏和副屏还得优化,Pad作为Mac副屏的功能延迟还有点高，需要着重优化。此外没有任何问题了，希望小米能尽快优化好，延迟高了很不舒服，非常影响使用体验。,4,2.1.0.200,天桥彭于晏,2025-09-30 21:48:34
13204083312,macOS,os3才能用,只能os3使用  更了个寂寞  手机都没推os3  这软件就急不可耐了,1,2.2.0,谷师傅11,2025-09-30 03:42:24
13201479718,macOS,支持个澎湃2会死啊,7月才装了这个软件，9月升级26，怕软件不兼容升了个级，我的小米pad5pro就被开除米籍了，脑子有病做出来的？,1,2.2.0,妇科圣手瘦大海,2025-09-29 11:25:22
13201262189,macOS,巨大黑框,目前不可用状态,2,2.2.0,kakadone,2025-09-29 10:21:36
13199380683,macOS,你们真的做完有用吗？,传过来后会偷吃文件不显示，好几个版本了都这样,1,2.2.0,月庄女表子,2025-09-29 00:59:53
13199239772,macOS,好评如潮,刚推出澎湃3就更新不给澎湃2手机用，推了几款手机。简单的传输照片也不行，搜索不到iPad，搜索到了就是等待中然后没了，照片传不过来。手机更是一坨,1,2.2.0,小米代言人,2025-09-29 00:00:47
13195051688,macOS,最新的17Pro也用不了,iPad和MAC都用不了，最新的17Pro也用不了,1,2.1.0.200,视频不能显示在相簿？,2025-09-28 01:11:32
13194224029,macOS,Mac上安装好登录小米账号就闪退，完全没法用,"“小米互联服务”意外退出。
点按“重新打开”以再次打开应用程序。点按“报告”以查看更多详细信息并将报告发送给Apple。",1,2.1.0.200,zhuzi121,2025-09-27 19:43:15
13194200514,macOS,macbook air m1 闪退报错 更新完之后没法用了,已在小米社区反馈问题，请尽快解决,1,2.1.0.200,i_am_lemon,2025-09-27 19:34:18
13193765902,macOS,妙享桌面大黑边,希望优化一下出个无黑边用经典三大金刚键模式，这样就可以很好的利用大屏幕带来的优势，有那个大黑边屏幕不能完全放大,3,2.1.1,小玛丽的小绵羊🐑,2025-09-27 16:49:33
13192583943,macOS,缺少高刷,连接使用没问题 但是没有高刷 比较卡顿,4,2.1.1,Doodler528,2025-09-27 10:13:20
13191347515,macOS,iPhone 通知无法在小米上显示,感觉更新了个寂寞，小米依旧无法显示 iPhone 的消息通知。,1,2.1.1,小熊同学xxx,2025-09-27 04:56:14
13190387463,macOS,更新优化一下,添加一下苹果手机收到小米手机微信，可以选择不直接跳转微信，和小米手机一样提示请到另一手机查看就行，不然一点击就跳转。希望弄个开关就行。可以自己选择知道了。,5,2.1.1,夸克加油666666666,2025-09-26 23:25:15
13189632848,macOS,增加相册文件夹,现在查看只能看所有图片，希望增加按相册文件夹查看，以及下载下来按文件夹直接分好相簿,3,2.1.1,李雷伊,2025-09-26 18:33:49
13188981289,macOS,垃圾小米,更新之后只支持os3了 产品经理脑子有洞,1,2.1.1,Turboooooooooooooo,2025-09-26 14:31:29
13187418363,macOS,真垃圾,之前还可以搜索到，后来一直搜索不到，真无语，啥也做不好，以前我以为是夸张，没想到真准,1,2.1.1,叮咚作响？,2025-09-26 06:57:54
13186676197,macOS,无法连接,手机连接显示已连接，iPad显示连接超时,3,2.1.1,这昵称绝了所以我改了,2025-09-26 03:33:31
13186021879,macOS,能不能把查找手机拿掉,放那么容易误触的位置，一不小心就点到了，尴尬的要死！！！！！,3,2.1.0.200,moroans,2025-09-25 23:22:54
13185298512,macOS,云相册加入一键把 iPhone所有照片上传功能，不然一个个点太麻烦,好不好，求求了,1,2.1.1,我真的是服啦(¯へ¯),2025-09-25 18:28:22
13184607712,macOS,不升级澎湃3不能用,产品经理什么脑回路？澎湃3正式版都没出，旧机型还得好几个月才能升，还有早就停更的机型全都直接给砍了不能用，纯逆天,1,2.1.1,ckurobac,2025-09-25 14:10:58
13182200866,macOS,无法使用,下载完成后，根本打不开，无法使用。,1,2.1.0.200,唐诗宋词元曲四,2025-09-25 02:41:06
13179583412,macOS,跟Hyper OS3.0兼容做的很好了,很厉害，首先实现微信qq能用，点赞。双机党福音。有的界面的UI和分辨率不太对，期待继续改进,5,2.1.0.200,随便来的一个昵称就为了发评论,2025-09-24 10:53:06
13178134858,macOS,升级之后小米13就用不了,软件层面强制用户买最新款，呵呵，再也不买小米了,1,2.1.0.200,牙牙侠,2025-09-24 04:19:00
13178054308,macOS,澎湃os3你倒是推送啊,突然就用不了了,1,2.1.1,cole姐,2025-09-24 03:53:15
13173437291,macOS,根本找不到我的小米手机,所有系统都是最新的,1,2.1.1,-、c n,2025-09-23 01:36:34
13168482644,macOS,非澎湃OS3不支持,我之前是OS2可以用，更新后就不支持了。那你在更新的时候就要直接标明。而且不支持历史版本，产品经理是不是脑子有问题？,1,2.1.0.200,我才是老六,2025-09-21 20:25:47
13168436356,macOS,只能澎湃 3 的用了,垃圾垃圾的垃圾,1,2.1.1,浸没．,2025-09-21 20:06:50
13159768208,macOS,小米手机上两个wx怎样用苹果查看,小米手机上两个wx怎样用苹果查看,5,2.1.1,垃圾车厂,2025-09-19 21:40:55
13157168668,macOS,不好用,连接上不会显示,1,2.1.1,萌小銘,2025-09-19 07:27:06
13151134631,macOS,小米传实况图到苹果手机,麻烦工程师看一下这条评价。小米手机实况图传到苹果手机后。苹果手机相册不显示。且找不到照片。必须在苹果文件管理找到。而是还不是实况图。这个小米互联服务更新了很多次了这个漏洞还是一直有…听到了吗？小米工程师,1,2.1.1,小红庙,2025-09-17 20:50:49
13148666961,macOS,打开直接闪退,RT，从两个礼拜前，尚未更新就出现打开直接闪退的问题，当时卸载从新安装、本次更新程序，都没能解决这个问题,1,2.1.0.200,帝王黑曼巴,2025-09-17 07:03:51
13147787634,macOS,澎湃OS 3与iOS 18.4.1互联体验,手持iPhone16 Pro max与小米15 Pro双设备，说实话在互联这个功能新上的时候确实挺期待的，实际体验下来感觉确实很方便，也能感觉到小米研发团队在持续的完善，尤其是这个版本更新后小米端也能查看到苹果端的信息，虽然不能在小米端回复苹果端的信息，但依旧是特别值得鼓励的。最后个人提个建议，希望后期可以考虑新增接听电话的功能（互相支持接听另外一个手机的电话），在我的生活中，常会出现一个手机在充电，另外一个手机拿在手里玩的情况，会觉得接电话这个功能要比回复微信更实用。,5,2.1.1,趣味星期三,2025-09-17 02:41:20
13147716250,macOS,开发跟测试吃干饭的吗！？,我就不明白，什么样的软件能到处都是BUG，性能卡顿的要死，在应用内发现有版本更新，想着更新会不会好点，然后下载完补丁后提示是否重启，点击重启，一点反应没有，再次进入也没有更新，开发跟测试是一群废物吗？每次写这么垃圾的东西，脸都不要了，产品想法不错，就是技术太差劲了,1,2.1.0.200,Charles 1998,2025-09-17 02:13:54
13147652240,macOS,搜索不到手机了,啥情况？之前都用的好好的，换个皮就搜索不到了，强行新系统，那你倒是推送新系统啊，还不让用了，真是服了，这什么逻辑？,1,2.1.1,海藻君吖,2025-09-17 01:49:00
13147378410,macOS,需要澎湃 3，差评,垃圾,1,2.1.0,戈多他爹,2025-09-16 23:55:40
13147230283,macOS,小米微信和QQ回复未适配iPhone se3,在iPhone se3机型上调用微信和QQ投屏时分辨率异常，触控偏移,4,2.1.0,随便一个名字不重复就行,2025-09-16 22:51:38
13146567780,macOS,搜不到,升级后搜不到平板，还显示要澎湃3，你才出来几天都全系手机平板推送了吗？马德，用的6sp平板也是头大，软件适配真是一坨翔,1,2.1.0,为了评论才取名字,2025-09-16 18:13:11
13145446661,macOS,缺失小米平板和苹果手机互联的功能,由此可见小米平板（）都不用，由此可见小米平板在小米公司内部是什么地位，他们觉得米板不配和苹果互联。但凡做这软件的人用一下小米平板他就会加上，用米板看剧关注一下苹果机的通知，难道很奇怪吗？这破7u的os3甚至不如7sp，平板系统快去和穿戴坐一桌吧，都烂泥扶不上墙,2,2.1.0,反步兵浣熊,2025-09-16 11:25:56
13144562442,macOS,是有什么大病,OS3 系统都还没推送 现在app就必须要升OS3 才能使用了，之前OS2 都能正常用。,1,2.1.0,shiinashin,2025-09-16 07:12:03
13144199549,macOS,之前还能用，为什么要我升级到澎湃3,开发这程序的人脑子进水了，前两天还能发到苹果ios15的设备，这次更新彻底不行了,1,2.1.0,paranoid26,2025-09-16 05:29:03
13143885176,macOS,澎湃OS3都没铺开,如题，澎湃OS3目前只在小米最新的机型上才有，连14系列都没铺开。结果现在就把这个互联升级成只有澎湃OS3才能连接的版本，真的下头！,1,2.1.0.200,AlexY2025,2025-09-16 03:48:57
13143071136,macOS,描述不符,2.1版本没有iPhone通知同步到小米手机选项,3,2.1.0,用户要求04,2025-09-15 21:58:40
13141602908,macOS,搜索不到小米手机,为什么我的苹果安装了后也连接了热点为什么搜索不到小米手机,3,2.0.1,小新暴富暴美,2025-09-15 12:07:23
13140732711,macOS,一如既往的恶心人，难用至极,升级后反到不能和自己小米手机传数据了，还要手机升级澎湃3后才能用。你新换皮os还没发布这破应用就记着出来恶心人了。,1,2.0.1,很好的👬,2025-09-15 07:41:09
13128910805,macOS,雷军，金凡！,主页设备定位外显且无法隐藏，缺乏应用内反馈渠道,2,2.0.201,！@#（——！）（#￥*）！,2025-09-12 08:34:35
13128022808,macOS,看不到隐私相册,没有相册分类,2,2.0.1,来一炮少年,2025-09-12 04:12:05
13126825815,macOS,澎湃2.0用不了了,垃圾垃圾垃圾！澎湃3才出个bate，这个破软件就直接强行只支持澎湃3，澎湃2直接就是抛弃掉了，乐,1,2.0.1,雷军大弟,2025-09-11 19:20:46
13126710891,macOS,无敌了,互联无敌,5,2.0.1,ZDX17,2025-09-11 18:31:33
13125189444,macOS,反向升级？,只支持os3了？那我14咋用？不会升级别升,1,2.0.1,xmyqm,2025-09-11 08:52:03
13123333168,macOS,苹果手机都不到小米电脑,只能从小米电脑上搜到手机并传输文件 反过来从手机压根搜索不到电脑更没法传文件 怎么解决,2,2.0.1,iPhone与小米电脑连接问题,2025-09-10 21:10:37
13123292234,macOS,苹果手机无法连接,更新后，苹果手机和电脑互传用不起了，能修复一下不？而且和os2的手机也不能互传了,1,2.0.1,无语到饱了,2025-09-10 20:50:52
13121139966,macOS,1.7.202之后的版本更新后  一直闪退,怎么恢复到之前的版本？？？有客服电话吗？  你们上架不做测试吗 ？,1,2.0.201,Changeze,2025-09-10 07:15:50
13120926981,macOS,打不开,扫码登录后闪退，后来一直打不开去。,1,2.0.201,yanxiangyuan,2025-09-10 06:14:50
13120737891,macOS,垃圾,同一个网络，一个小米一个苹果就是搜索不到对方，垃圾APP,1,2.0.1,好可爱啊，好玩,2025-09-10 05:18:05
13120330606,macOS,产品经理就是it届民科,什么都是不懂的，只知道强行适配澎湃os3,1,2.0.1,ANORTHTON,2025-09-10 02:56:37
13120163891,macOS,升级后只支持hyperOS3了，成功修复了小米用户过多的bug,之前用的好好的，升级后一定要hyperos3了，这也能反向升级？抛弃老用户？,1,2.0.1,BillionYu_SH,2025-09-10 01:45:52
13119436437,macOS,更新之后手机界面显示连接超时，但返回键可以控制手机,更新之后手机界面显示连接超时，但返回键可以控制手机,1,2.0.200,utopia_x,2025-09-09 20:01:52
13118979227,macOS,无法使用,更新之后直接闪退，这很难评,1,2.0.200,地里背苞谷,2025-09-09 16:49:16
